{
    "$schema": "https://json-schema.org/draft/2019-09/schema",
    "title": "Document",
    "type": "object",
    "properties": {
        "$schema": {
            "type": "string"
        },
        "DocEntry": {
            "type": "integer"
        },
        "CardCode": {
            "type": "string",
            "minLength": 1,
            "maxLength": 32,
            "test":1
        },
        "DocTotal": {
            "description": "Document Total",
            "type": "number"
        },
        "Lines": {
            "type": "array",
            "items": {
                "$ref": "documentDetail.json"
            }
        }
    },
    "additionalProperties": false,
    "required": [
        "CardCode"
    ]
}